{
  "$schema": "https://json-schema.org/draft/2020-12/schema",
  "version": 1,
  "properties": {
    "node_id": {
      "type": "string"
    },
    "role": {
      "type": "string"
    },
    "uses": {
      "type": "string"
    },
    "with": {
      "type": "object"
    },
    "version": {
      "const": 1
    }
  },
  "required": [
    "node_id",
    "uses",
    "with"
  ],
  "title": "MirrorNeuron Agent Template Instance",
  "type": "object"
}
